title,content,note_type,rating,helpful_count
"IM IMG culture","Very welcoming to international graduates; many senior residents are IMGs.","experience",5,14
"Interview vibe","Virtual interview day was well organized with faculty and current residents.","interview",4,9
"Visa guidance","Coordinator provides clear J1 paperwork checklist after rank list release.","visa",4,7
"Housing tip","Look for sublets in nearby neighborhoods; hospital housing availability is limited.","tip",3,11
"Cost note","Interview costs are low because program offered virtual interviews this cycle.","cost",4,5
"Research note","Academic track and QI projects are easy to join; import research month later.","experience",4,6